Link of experience,content,Ranking,Keyword-1,Keyword-2,Keyword-3,Keyword-4,Keyword-5,priceshttps://www.teamraderie.com/experiences/empower-people-and-teams-through-vision-collaboration/,"https://www.teamraderie.com/experiences/empower-people-and-teams-through-vision-collaboration/: Looking to improve team collaboration and dynamics? Teamraderie offers a unique team building
experience where your team can learn to make ice cream together. This experience is suitable for
hybrid, remote, or in-person teams. Trust is the foundation of teamwork, and Teamraderie offers a
journey to deepen team trust and address broken trust within the team. They also provide solutions
to embrace resilience and change, grow psychological safety, and level up team communication. In
addition to team journeys, Teamraderie also plans team events such as offsite meetings, sales
kickoffs, customer events, and marketing events. One of their experiences is ""Empower People and
Teams Through Visual Collaboration,"" led by a visual collaboration expert. This experience aims to
enhance collaboration and creativity within the team by teaching key creative skills and practicing
together. The experience is customizable for teams of 1 to 100 people and includes live virtual
facilitation, customer support, and post-experience resources. Tim May, a visual thinking expert, is
one of the hosts for this experience. Customer reviews have praised Teamraderie for surpassing
expectations and providing a fun and bonding experience for teams. To book this experience or
explore other team building options, visit the Teamraderie website.",7,Skill Building,Communication,Impact,Purpose,Drawing,"2000.00 plus 0 per person for 1 to 20 people,2500.00 plus 0 per person for 21 to 50 people,3000.00 plus 0 per person for 51 to 70 people,3450.00 plus 0 per person for 71 to 100 people"https://www.teamraderie.com/experiences/intention-setting-and-gifting-experience/,"https://www.teamraderie.com/experiences/intention-setting-and-gifting-experience/: Teamraderie offers an experience called ""Intention Setting and Gifting for Team Appreciation."" This
experience is available globally and lasts for 55 minutes. The cost starts at $300, with an
additional $50 per person. The experience includes a kit that will be shipped internationally if
needed. 

During the experience, the team will discuss both the team as a whole and the individual
strengths of each team member. This will culminate in a surprise gift based on everyone's strengths.
After the experience, each team member will receive a book and treats related to their unique
strengths. 

The goal of this experience is to build team trust, create inclusion and belonging, and
transform the foundation of the team. It is designed to bring the team together, set intentions for
the year, and celebrate appreciation as a team. 

The experience is led by Jeremy DiAsio, a host
with a passion for bringing people together. Optional add-ons to the kit include a custom note card
and the company's logo on the box. 

Customer reviews for this experience have been positive, with
participants praising it as a unique way to celebrate and connect with their team. 

To book this
experience or request a custom quote, customers can visit the Teamraderie website.",7,Recognition,Gifting,Planning,Purpose,Role Definition,"300.00 plus 50.0 per person for 1 to 15 people,400.00 plus 50.0 per person for 16 to 25 people"https://www.teamraderie.com/experiences/team-storytelling-event/,"https://www.teamraderie.com/experiences/team-storytelling-event/: Introducing the Team Storytelling Experience by Teamraderie! Shake up your summer with an ice cream
making experience for your team. This experience is available globally and lasts for 45 minutes. The
cost is $2,000 for up to 20 people, and you can place a free '48-hour hold' on your preferred date
and time. The experience includes live virtual facilitation, live customer support, and post-
experience resources. The host for this experience is Tim May, a visual thinking machine and
Creative Director at XPLANE. Tim has received rave reviews from previous customers. To book this
experience or request a quote, visit the Teamraderie website.",7,Communication,Skill Building,Storytelling,Upleveling,Team Effectiveness,"2000.00 plus 0 per person for 1 to 20 people,2500.00 plus 0 per person for 21 to 50 people,3000.00 plus 0 per person for 51 to 70 people,3450.00 plus 0 per person for 71 to 100 people"https://www.teamraderie.com/experiences/virtual-team-refresh/,"https://www.teamraderie.com/experiences/virtual-team-refresh/: Elevate your team's summer experience with a refreshing ice cream making activity offered by
Teamraderie. This virtual team building experience is designed to improve team dynamics and foster
camaraderie among hybrid, remote, or in-person teams. Trust is emphasized as the foundation for
success, and the program includes exercises led by Dr. Kathryn Velcich from Stanford University.
Participants will learn how to establish team norms, transform their foundation, and unlock their
team's highest potential. The experience has received positive reviews from previous customers, who
found it effective in bringing their teams together and addressing underlying issues. The experience
is available for up to 20 people and can be booked online with a free 48-hour hold. Live virtual
facilitation, customer support, and post-experience resources are included. Teamraderie offers a
range of other experiences to help teams grow in areas such as psychological safety, team
communication, and resilience. Contact information for Teamraderie is provided for further
inquiries.",6,Communication,Conflict,Inflexible Work Processes,Ineffective Decision-Making,Workplace Relationships,"2000.00 plus 0 per person for 1 to 20 people,2500.00 plus 0 per person for 21 to 50 people,3000.00 plus 0 per person for 51 to 70 people,3450.00 plus 0 per person for 71 to 100 people"https://www.teamraderie.com/experiences/team-jazz-experience-master-art-of-improvisation/,"https://www.teamraderie.com/experiences/team-jazz-experience-master-art-of-improvisation/: Learn from Jazz: Master the Art of Improvisation with Teamraderie. Shake up your summer with an ice
cream making experience for your team. Teamraderie offers solutions to improve team dynamics across
your company, whether your team is hybrid, remote, or in-person. Deepen team trust, embrace
resilience and change, grow psychological safety, and level-up team communication. Plan your team's
event, such as offsite meetings, sales kickoffs, customer events, marketing events, or enterprise
experiences. Learn from Jazz: Master the Art of Adapting Together as a Team is a 45-minute
experience available globally. The cost is $2,000 for up to 20 people. The experience is led by
Professor Frank Barrett, a jazz musician and author of the book ""Yes to the Mess: Surprising
Leadership Lessons from Jazz."" The experience focuses on collaboration, skill development, flexible
learning mindset, forming a united team, and creative problem-solving. Customer reviews rave about
the engaging and impactful nature of the experience. Book this experience to unleash your team's
full potential.",6,Improvisation,Navigating Uncertainty,Ineffective Decision-Making,Unique Activity,Jazz,"2000.00 plus 0 per person for 1 to 20 people,2500.00 plus 0 per person for 21 to 50 people,3000.00 plus 0 per person for 51 to 70 people,3450.00 plus 0 per person for 71 to 100 people"https://www.teamraderie.com/experiences/unleash-creativity-improv-your-way-to-generating-breakthrough-ideas/,"https://www.teamraderie.com/experiences/unleash-creativity-improv-your-way-to-generating-breakthrough-ideas/: Looking to boost creativity and team dynamics? Consider booking the Team Improv Experience for
Creativity offered by Teamraderie. This 45-minute virtual experience, led by Stanford's Pam McLeod,
aims to unleash your team's ability to generate breakthrough ideas through improv techniques. By
constantly generating new ideas, responding to unexpected developments, and making connections
between disparate elements, your team will strengthen their collaboration skills and develop a solid
foundation for optimal team performance. Whether your team is hybrid, remote, or in-person, this
experience is designed to improve team dynamics across your company. The cost for this experience is
$1,200 for up to 20 people, and it includes live virtual facilitation, live customer support, and
post-experience resources. Previous customers have praised Teamraderie for their ability to bring
team members together and create a fun and easy way to connect. To book this experience or request a
custom quote, visit the Teamraderie website.",6,Improv,Creativity,Collaboration,Innovation,Bonding,"1200.00 plus 0 per person for 1 to 20 people,1500.00 plus 0 per person for 21 to 50 people"https://www.teamraderie.com/experiences/virtual-beer-experience/,"https://www.teamraderie.com/experiences/virtual-beer-experience/: Introducing the Virtual Beer Experience by Teamraderie, a team building event that celebrates women-
run breweries. This 45-minute experience includes a kit with four craft beers from women-owned
breweries, popcorn, and a commemorative glass. If preferred, the craft beers can be replaced with
four non-alcoholic brewed drinks with similar flavor profiles. An acclaimed beer expert will guide
the team through the tasting, sharing stories about each brewery and its owners and brewers. The
experience aims to unite the team, build connections, and foster trust. The kit also includes
optional add-ons such as a custom note card or logo on the box. Customer reviews rave about the fun
and engaging nature of the experience. The Virtual Beer Experience is available for U.S.-only teams
and can be booked through the Teamraderie website.",6,Bonding,Connection,Fun,Beer,Tasting,100.0 per personhttps://www.teamraderie.com/experiences/virtual-team-event-with-tatyana-mcfadden/,"https://www.teamraderie.com/experiences/virtual-team-event-with-tatyana-mcfadden/: Teamraderie is offering a virtual team building event with Tatyana McFadden, the world's most-
decorated Paralympian athlete. The event is aimed at improving team dynamics and can be done by
hybrid, remote, or in-person teams. The event focuses on deepening team trust and includes
activities to promote resilience, change, psychological safety, and team communication. The event
can be customized for offsite meetings, sales kickoffs, customer events, and marketing events. The
experience is a 45-minute session with Tatyana McFadden where she shares her tips on setting goals
with purpose. The experience costs $2,000 for up to 20 people and includes live virtual
facilitation, live customer support, and post-experience resources. Customer reviews of the
experience have been positive, with participants finding it engaging and inspirational. To book the
experience, customers can complete the booking process on the Teamraderie website.",6,Inspiration,Goal-Setting,Purpose,Olympian,Discussion,"2000.00 plus 0 per person for 1 to 20 people,2500.00 plus 0 per person for 21 to 50 people,3000.00 plus 0 per person for 51 to 70 people,3450.00 plus 0 per person for 71 to 100 people"https://www.teamraderie.com/experiences/virtual-beer-tasting-events-teamraderie/,"https://www.teamraderie.com/experiences/virtual-beer-tasting-events-teamraderie/: Teamraderie offers a virtual beer tasting experience for team building events. Led by a top
cicerone, participants will learn about ancient beer-making secrets and taste four contemporary beer
styles. The experience aims to form a united team, build connections, and share with clients and
customers. Each kit includes four different cans of craft beers, popcorn, and a commemorative pint
glass. Optional add-ons include a custom note card and logo on the box. Customer reviews praise the
fun and engaging nature of the experience. The booking process allows for a free 48-hour hold on
preferred dates and times. The experience is U.S.-only. Teamraderie also offers other team building
experiences and solutions to improve team dynamics.",6,Bonding,Connection,Fun,Beer,Tasting,100.0 per personhttps://www.teamraderie.com/experiences/virtual-team-building-for-winning/,"https://www.teamraderie.com/experiences/virtual-team-building-for-winning/: Experience virtual team building with Olympian Lilly King through Teamraderie. Lilly King, a world-
record holder and five-time Olympic medalist, will teach your team how to ""change the game"" and beat
rivals. This experience focuses on training for success in imperfect moments and adding a new
dimension to any competition. It is designed to boost energy, motivation, and productivity, create a
united team, and build trust and connection with clients and customers. The experience includes live
virtual facilitation, live customer support, and post-experience resources. Lilly King is a highly
acclaimed host for this experience, and previous customers have praised the engaging and thought-
provoking discussions. The cost for this experience is $3,000 for up to 20 people, and you can
request a quote or place a free 48-hour hold on your preferred date and time. Teamraderie offers a
range of other team-building experiences and solutions to help improve team dynamics across your
company.",5,Competition,Winning,Rethinking,Strategy,Sales Team,"3000.00 plus 0 per person for 1 to 20 people,3750.00 plus 0 per person for 21 to 50 people,4500.00 plus 0 per person for 51 to 70 people,5175.00 plus 0 per person for 71 to 100 people"https://www.teamraderie.com/experiences/uncover-the-power-of-asking-better-questions-for-connection/,"https://www.teamraderie.com/experiences/uncover-the-power-of-asking-better-questions-for-connection/: Looking to improve team communication and deepen trust within your team? Consider booking the ""How
to Ask Better Questions for Effective Team Communication"" experience with Teamraderie. Led by Taylor
Buonocore-Guthrie, co-founder of Convers(ate), this 45-minute session will teach your team about the
most effective question types and how to ask the best questions. By unleashing your team's curiosity
and avoiding common conversation missteps, you can enhance team dynamics and create a solid
foundation for optimal performance. This experience is suitable for teams of up to 20 people and is
available globally. The cost is $2,000 and includes live virtual facilitation, customer support, and
post-experience resources. Book now to secure your preferred date and time or request a custom
quote. Teamraderie is dedicated to providing intentionally curated experiences that help teams reach
their full potential.",5,Communication,Remote Collaboration,Feedback,Mentoring,Questioning,"2000.00 plus 0 per person for 1 to 20 people,3500.00 plus 0 per person for 21 to 50 people"https://www.teamraderie.com/experiences/coffee-cupping-event/,"https://www.teamraderie.com/experiences/coffee-cupping-event/: Experience the Coffee ""Cupping"" Virtual Experience with Teamraderie. This team building activity
allows you to deepen team trust and improve team dynamics across your company, whether your team is
hybrid, remote, or in-person. Led by Sara Larsson, Head of Education and Events at Square Mile
Coffee Roasters, you will taste five varieties of coffee and learn how to identify the roast level,
origin, and processing method that best matches your taste. The experience includes a coffee cupping
kit with five coffees, a cupping spoon, a digital gram scale, and a coffee cupping guide. Please
note that the kits cannot be shipped to Spain, Poland, and Romania due to import and customs
regulations. Optional add-ons include a custom note card and your logo on the box. Customer reviews
rave about the generous kit and engaging host. Book this experience for $95 per person and add
shipping at checkout. International attendees are welcome.",5,Bonding,Connection,Fun,Tasting,Coffee,95.0 per personhttps://www.teamraderie.com/experiences/games-for-teams/,"https://www.teamraderie.com/experiences/games-for-teams/ ignite a thriving team is a 45-minute experience led by Stanford's Pam
McLeod. In this experience, your team will learn how to engage everyone, build trust, and feel
unified through three improv games that can be utilized throughout the year. 

Customer reviews rave
about the effectiveness of Teamraderie's experiences, with one customer mentioning how it was a fun
and easy way to connect with new team members. Another customer used it as a kickoff for their post-
merger team, while others praised its ability to encourage inclusivity and adaptability in today's
environment. 

To book an experience with Teamraderie, simply complete the booking process on their
website. Prices start at $1,200 for up to 20 people, and the experience includes live virtual
facilitation, customer support, and post-experience resources. 

So why wait? Unleash your team's
full potential with Teamraderie's engaging virtual games and experiences.
",5,Hybrid Work,Games,Improv,Team Dynamics,Connection,"1200.00 plus 0 per person for 1 to 20 people,1500.00 plus 0 per person for 21 to 50 people"https://www.teamraderie.com/experiences/swirl-sniff-and-swallow-a-journey-through-olive-oil/,"https://www.teamraderie.com/experiences/swirl-sniff-and-swallow-a-journey-through-olive-oil/: Teamraderie offers a virtual olive oil tasting experience as a team building activity. The
experience lasts for 45 minutes and includes a tasting kit with options for vegan, gluten-free, and
nut-free diets. The experience is available globally and offers non-alcoholic options. The cost is
$95 per person, with the option to add shipping at checkout. The kit includes three different award-
winning single-varietal olive oils, balsamic vinegar, Rustic Bakery sourdough flatbread, blue
tasting cups, sparkling water for palate cleansing, and a tasting mat. The experience is led by
Craig Hilliker, a certified Master Sensory Evaluator and Master Miller of olive oil. The experience
aims to form a united team, build connections, and share with clients and customers. Optional add-
ons include a custom note card and adding your logo to the box. Customer reviews praise the
beautiful packaging and expert facilitation of the experience. Teamraderie also offers other team
building experiences and solutions for improving team dynamics.",5,Bonding,Connection,Fun,Tasting,Olive Oil,95.0 per personhttps://www.teamraderie.com/experiences/the-roi-of-sleep-team-sleep-experience/,"https://www.teamraderie.com/experiences/the-roi-of-sleep-team-sleep-experience/: Unlock the Power of Your Best Night's Rest with ""The ROI of Sleep"" Team Experience by Teamraderie.
In this 45-minute virtual experience, a certified Sleep Science Academy coach will guide your team
through the importance of sleep and provide tools to improve sleep quality. By prioritizing sleep,
your team can increase productivity, innovation, personal growth, and happiness. Through diagnostic
assessments, discussions, and group exercises, your team will learn techniques to fall asleep
faster, rest deeper, and wake up refreshed. This experience is suitable for teams of up to 20 people
and costs $2,000. Book now to form a united team, improve wellbeing, and unlock the power of a good
night's rest.",4,Wellbeing,Sleep,Rest,Health,Wellness,"2000.00 plus 0 per person for 1 to 20 people,3000.00 plus 0 per person for 21 to 50 people,4000.00 plus 0 per person for 51 to 70 people,5000.00 plus 0 per person for 71 to 100 people"https://www.teamraderie.com/experiences/diversity-and-inclusion-experience/,"https://www.teamraderie.com/experiences/diversity-and-inclusion-experience/: Teamraderie offers a Diversity & Inclusion Experience for Remote Teams. They provide various
solutions to improve team dynamics, whether the team is hybrid, remote, or in-person. One of their
experiences is called ""Applying Lessons from the Past for an Inclusive Present,"" which is a
45-minute virtual session available globally. The experience is led by Marcia Chatelain, a Pulitzer
Prize-winning author, who explores how to create meaningful change by applying lessons from
McDonald's history. The experience aims to boost energy and motivation, create inclusion and
belonging, form a united team, and transform the team's foundation. The cost of the experience is
$4,500 for up to 20 people, and it includes live virtual facilitation, live customer support, and
post-experience resources. Customer reviews praise Dr. Chatelain's work and describe the experience
as inspiring and providing a new perspective on American culture. Teamraderie offers other curated
experiences to help teams unleash their full potential. They can be contacted for a custom quote.",4,DEI&B,Racial Justice,Perspective,Impact,Rethinking,"4500.00 plus 0 per person for 1 to 20 people,5625.00 plus 0 per person for 21 to 50 people,6750.00 plus 0 per person for 51 to 70 people,8000.00 plus 0 per person for 71 to 100 people"https://www.teamraderie.com/experiences/maple-syrup-tasting-experience/,"https://www.teamraderie.com/experiences/maple-syrup-tasting-experience/: Teamraderie offers a Maple Syrup Tasting experience for remote team building. This experience allows
teams to deepen trust and improve team dynamics. The experience includes a kit with four different
grades of maple syrup samples, mini pancakes, maple candies, and utensils. The experience is led by
experienced hosts, Jeremy DiAsio and Brodie Vissers, who have extensive knowledge in food and
beverage. Optional add-ons include a custom note card and logo on the box. Customer reviews rave
about the exceptional kit and the opportunity for team bonding. The experience can be booked online
and includes live virtual facilitation, customer support, and international shipping. Teamraderie
also offers other team building experiences in categories such as food tastings.",3,Bonding,Connection,Fun,Perspective,Tasting,65.0 per personhttps://www.teamraderie.com/experiences/design-a-team-ritual-activity/,"https://www.teamraderie.com/experiences/design-a-team-ritual-activity/: Design a Team Ritual to Boost Collaboration and Productivity

Teamraderie offers a unique experience
to enhance team collaboration and productivity through a team ritual. This 45-minute virtual
experience, available globally, aims to create meaningful rituals that foster connection and
productivity within the team.

Led by Stanford Professor Glenn Fajardo, participants will learn how
to establish a shared purpose and identity, leading to better communication and decision-making. The
ritual will celebrate successes, acknowledge challenges, and provide a sense of closure, creating a
more motivated and engaged team.

This experience is suitable for teams of up to 30 people and costs
$1,500. It includes live virtual facilitation, live customer support, and post-experience resources.
Participants can book the experience by completing the booking process on the Teamraderie website.
The team ritual experience is designed to help teams develop crucial skills, establish team norms,
transform their foundation, and work effectively as a distributed team. It is a great opportunity to
level up the team's performance and enhance collaboration, regardless of their location.

Customer
reviews have praised the international appeal of the experience and the phenomenal content and game.
Participants have also appreciated Glenn Fajardo's expertise and the concept of creating their own
ritual.

To book this experience or request a custom quote for your team, visit the Teamraderie
website. Stay up to date with the latest news and offerings from Teamraderie by subscribing to their
newsletter.",2,Remote Work,Improvement,Virtual Meetings,Team Norms,Remote Collaboration,"1500.00 plus 0 per person for 1 to 30 people,1875.00 plus 0 per person for 31 to 50 people"https://www.teamraderie.com/experiences/find-team-balance-with-mindful-team-meditation/,"https://www.teamraderie.com/experiences/find-team-balance-with-mindful-team-meditation/: Improve team dynamics across your company with mindful meditation. This experience, offered by
Teamraderie, is available globally and lasts for 30 minutes. It is suitable for teams of up to 30
people. The cost is $1,000. The experience includes live virtual facilitation, live customer
support, and post-experience resources. The host for this experience is Kevin Hekmat, a corporate
well-being and mindfulness coach with over 30 years of experience. He will teach participants how to
manage stress and anxiety through mindful meditation, bringing balance to their day. This experience
is beneficial for forming a united team and improving overall well-being. Customer reviews have
praised Kevin's ability to provide tools for stress management and create an interactive and
valuable experience. To book this experience, complete the booking process on the Teamraderie
website.",2,Work-Life Balance,Burnout,Meditation,Mental Health,Relaxation,"1000.00 plus 0 per person for 1 to 30 people,1200.00 plus 0 per person for 31 to 50 people,1500.00 plus 0 per person for 51 to 70 people,1750.00 plus 0 per person for 71 to 100 people"