Link of experience,content,Ranking,Keyword-1,Keyword-2,Keyword-3,Keyword-4,Keyword-5,priceshttps://www.teamraderie.com/experiences/power-of-perspective-the-garry-kasparov-experience/,"https://www.teamraderie.com/experiences/power-of-perspective-the-garry-kasparov-experience/: Introducing the Garry Kasparov Virtual Team Building Experience by Teamraderie. This experience is
available globally and lasts for 45 minutes. It is priced at $20,000 for up to 100 people. The
experience includes live virtual facilitation, live customer support, and post-experience resources.
Garry Kasparov, a former chess Grandmaster and current chairperson of the Human Rights Foundation,
will lead the experience. With over 20 years of experience as the world's top-ranked chess player,
Kasparov brings a unique perspective to leadership and strategy. Participants will have the
opportunity to learn from his expertise and apply chess theory to their own teams. This experience
is perfect for boosting energy and motivation, developing skills, forming a united team, sharing
with clients and customers, and trying creative problem-solving. Customer reviews have praised the
inspirational and thought-provoking nature of the session. To book this experience or request a
quote, visit the Teamraderie website.",1,Strategy,Artificial Intelligence (AI),Empowerment,Growth Mindset,Chess,"20,000 for up to 100 people"https://www.teamraderie.com/experiences/team-improv-experience-for-connection-and-empathy/,"https://www.teamraderie.com/experiences/team-improv-experience-for-connection-and-empathy/: Teamraderie offers a Team Improv Experience for Connection & Empathy. This experience aims to
improve team dynamics and enhance empathy and communication skills. The experience is available
globally and lasts for 45 minutes. The cost is $1,200 for up to 20 people. The experience includes
live virtual facilitation, live customer support, and post-experience resources. The host for this
experience is Pam McLeod, who has experience working with geographically dispersed teams. Customer
reviews have praised the experience for its ability to foster connection and trust within teams. To
book this experience, customers can complete the booking process on the Teamraderie website.",1,Creativity,Improv,Inclusion,Belonging,Fun,"1200.00 plus 0 per person for 1 to 20 people,1500.00 plus 0 per person for 21 to 50 people"https://www.teamraderie.com/experiences/setting-up-your-team-for-hybrid-work/,"https://www.teamraderie.com/experiences/setting-up-your-team-for-hybrid-work/: Teamraderie offers virtual team building experiences for hybrid teams. One of their experiences is
an ice cream making activity. They also provide solutions for improving team dynamics, trust,
resilience, and communication. The experiences are suitable for remote, hybrid, or in-person teams.
The company emphasizes the importance of trust in team building and offers resources to deepen team
trust. The ice cream making experience is led by Glenn Fajardo, a co-author and fellow at Stanford
University. Customer reviews praise the customization and effectiveness of the experience. The cost
for the experience is $1,500 for up to 30 people. Teamraderie also offers live virtual facilitation,
customer support, and post-experience resources.",1,Hybrid Work,Inefficient Processes,Remote Collaboration,Virtual Meetings,Improvement,"1500.00 plus 0 per person for 1 to 30 people,1875.00 plus 0 per person for 31 to 50 people,2250.00 plus 0 per person for 51 to 70 people,2600.00 plus 0 per person for 71 to 100 people"https://www.teamraderie.com/experiences/learn-movements-to-wake-up-team-productivity/,"https://www.teamraderie.com/experiences/learn-movements-to-wake-up-team-productivity/: Get ready to boost your productivity with an invigorating live session led by celebrity trainer Ramona Breganza! Join Jessica Alba & Ryan ReynoldsÕ personal trainer as she guides you and your team through 5 movements that will awaken your body and get it moving, all from the comfort of your desk. Say goodbye to stiffness and fatigue and hello to increased energy levels and productivity with this exciting experience!The
experience aims to create a united team and improve wellbeing. Customers have praised the wellness-
focused event and the simple yet effective exercises taught by Ramona. The experience is available globally can be booked
for up to 20 people and includes live virtual facilitation, customer support, and post-experience
resources. Teamraderie offers a range of other experiences and categories to help teams reach their
full potential.",1,Work-Life Balance,Burnout,Healthy,Mental Acuity,Wellness,"600.00 plus 0 per person for 1 to 20 people,750.00 plus 0 per person for 21 to 50 people,900.00 plus 0 per person for 51 to 70 people,1050.00 plus 0 per person for 71 to 100 people"https://www.teamraderie.com/experiences/the-simplicity-principle-experience-with-julia-hobsbawm/,"https://www.teamraderie.com/experiences/the-simplicity-principle-experience-with-julia-hobsbawm/: Join Julia Hobsbawm for a virtual team building experience focused on achieving clarity and
simplicity in a complex world. Based on her book ""The Simplicity Principle,"" Julia will guide your
team through the six steps to simplify your life and work. This experience will help you establish
team norms, transform your foundation, and unleash your team's full potential. The experience
includes live virtual facilitation, live customer support, and post-experience resources. The cost
is $1,000 for up to 20 people, and you can place a free '48-hour hold' on your preferred date and
time. Julia Hobsbawm is an award-winning writer, speaker, and consultant, and she will be your host
for this experience. Previous customers have praised the engaging and informative nature of the
experience. To book this experience or request a custom quote, visit the Teamraderie website.",1,Simplification,Inefficient Processes,Inefficient Decision-Making,Low Team Morale,Inflexible Work Processes,"1000.00 plus 0 per person for 1 to 20 people,1500.00 plus 0 per person for 21 to 50 people,1800.00 plus 0 per person for 51 to 70 people,2100.00 plus 0 per person for 71 to 100 people"https://www.teamraderie.com/experiences/virtual-team-building-with-erik-schlopy/,"https://www.teamraderie.com/experiences/virtual-team-building-with-erik-schlopy/: Experience the Virtual Olympic Team Building with Erik Schlopy, a three-time Olympic alpine ski
racer and member of the U.S. Skiing and Snowboarding Hall of Fame. In this 45-minute interactive
experience, Erik will explore the parallels between alpine skiing and business, helping your team
develop crucial skills for optimal performance. Erik is known for his innovative approach to the
sport and his contributions to redefining how skiers prepare for competition. This experience is
suitable for teams of up to 20 people and includes live virtual facilitation, customer support, and
post-experience resources. Book now to take your team's performance to the next level!",1,Communication,Risk Taking,Skiing,Olympian,Science,"2000.00 plus 0 per person for 1 to 20 people,2500.00 plus 0 per person for 21 to 50 people,3000.00 plus 0 per person for 51 to 70 people,3450.00 plus 0 per person for 71 to 100 people"